{"ts": "2026-10-01T04:10", "id": "V8a", "kind": "step", "title": "V8 label collection: grasp-stable and seated events from the perturbed rack expert", "result": "scripts/27_force_labels.py: events at the end of 'close' (label: still held after the lift) and at bolt release (label: seated within 2 s); 189 features (torque_hist 150, tactile 32, tau_ext 7); smoke seed: 15 events, both grasp outcomes. Collecting 120 seeds (9000-9119) in 2 containers | round 1: 1187 events (894 grasp, 293 release); held-out (36 seeds): grasp-stable all 84 % / tactile 85 % / torque 56 % / majority 77 %; seated all 76 % / tactile 72 % / torque 65 % / majority 57 %. Below the 95 % gate. | round 2 (release +1 ... +10 mm): grasp-stable logistic 87 %, MLP (64 tanh, numpy) 96.1 % on 256 held-out events (majority 79 %) - meets the 95 % gate; seated: 95 % of releases seat, detectors (93 %) below the majority - no real negatives | round 3 (blocked releases, label = seated later): balanced (52 %), best 78 % (torque only) - label partly decided after release by the chamfer. Grasp-stable pooled over rounds 1-3 (822 held-out events): logistic 87 %, MLP 64 94.6 %, MLP 128 95.1 % (second configuration on the same split - borderline) | round 4 (label = tip in the hole at release, 1303 events / 321 releases): seated torque-only 85.3 % (balanced 85.3), all-features logistic 82.4, MLP 82.4, tactile 53.9, majority 49 % (102 held-out). Grasp MLP 93.9 % on this round alone. | all round-4-style data (520 seeds, ~5400 events): grasp-stable MLP 94.7 % (balanced 93.0 %, n=1208); seated-in-hole MLP 89.4 % / logistic 89.1 % / torque-only 88.4 % / tactile-only 58.4 % (n=404, 50 % positives). Gate 95 % not met. | round 5 (+ Cartesian wrench history, 60 features): no gain - grasp-stable MLP 94.3 % (n=1208), seated-in-hole MLP 91.3 % (n=404); wrench-only 87.6 %, all+wrench logistic 88.9 %. Gate (> 95 %) not met for either after 5 data rounds; best: grasp-stable 95.1 % (MLP-128, borderline, second config on the same split), seated 91.3 %.", "verdict": "failed", "runs": "outputs/v8_labels", "note": "expert knobs grasp_dz (extra grasp height, randomised -6 ... +12 mm per attempt) and release_depth (randomised -4 ... +10 mm) make both outcomes occur; defaults leave the expert unchanged. Detector next: logistic regression on held-out seeds (no sklearn in the images: numpy). | Round-1 seated labels were partly unobservable: releases above the fixture top (-4 mm) never touch anything, so force cannot tell a lucky drop from a miss -> round 2 releases at +1 ... +10 mm only (entered freely vs blocked has a contact signature). Collecting again (outputs/v8_labels; round 1 kept in outputs/v8_labels_r1). | round 3 (running): half the bolt attempts aim 3 mm off and let go where blocked (expert knob release_on_block, default off) for real seated negatives | round 4 (running, 6 containers): release label = tip inside the hole at the moment of release | collecting 400 more seeds (9120-9519, 8 containers) for the release detector | next: features in Cartesian space - the 10-frame tau_ext history mapped through pinv(J^T) at the event (the arm is quasi-static over the 2 s window) -> a wrench history (60 features), like Stage 1's wrist F/T; joint torques are pose-dependent and a simple classifier cannot undo that. | conclusion: tactile carries the grasp signal, joint torque the insertion signal; a single-event snapshot classifier plateaus ~91-95 %. The features stay in the data for V9."}
{"ts": "2026-10-01T08:30", "id": "V6-pick", "kind": "experiment", "title": "V6 pick skill: SortPickEnv + TD3+BC, with vs without force", "result": "final on 50 unseen set-ups (best checkpoint), seeds 0-7 (8, 9 running): force 0.98 0.96 1.00 1.00 1.00 1.00 1.00 1.00 (mean 0.992); no force 1.00 1.00 1.00 1.00 0.98 1.00 1.00 1.00 (mean 0.998). Ceiling: no force effect measurable on picking from the rack/tray | seeds 8-9: force 0.98 / 0.98, no force 1.00 / 0.98 -> 10 seeds each: force 0.990, no force 0.996", "verdict": "kept", "runs": "outputs/td3_pick", "note": "the target part's grasp point is given with +-3 mm noise (a vision estimate); the expert set-up chooses the part and the hand yaw. | the pick skill is at the ceiling with demos alone, so it cannot show a force benefit; the later RL collapse is the Stage 1.5 pattern (bc-final 1.0 is not enough here)."}
{"ts": "2026-10-01T10:40", "id": "V6-seq", "kind": "experiment", "title": "V6 full sort: scripted sequencer with the learned pick + insert skills (scripts/29_skill_sequencer.py)", "result": "10 seeds, noisy expert, force skills (pick force_s2, insert force_s0): 0/10 episodes, pick 12/12, insert 0/12 (every insert ends in a force abort)", "verdict": "failed", "runs": "outputs/seq_force_noisy", "note": "diagnosis: the hand-off code is exact (attach path vs the skill env's own reset on identical scenes: observation difference 0.0, same outcomes); the insert skill succeeds after the EXPERT's pick on the same scenes (3 of 4) but not after the LEARNED pick: the learned pick grasps the bolt head 3-7 mm off centre along the pad (expert 0-2 mm) and tilted up to 12 deg (expert 2-4 deg) - its success criterion (held + lifted) never rewarded grasp quality, and the insert skill only ever saw the expert's centred grasps. Skills trained in isolation do not compose. Next: train the insert skill on randomised in-hand offsets (+-7 mm along the pad, 0..+4 mm height) - where tactile CoP should matter - and/or reward centred grasps in the pick skill."}
{"ts": "2026-10-01T12:30", "id": "V6-grand", "kind": "experiment", "title": "V6 insert skill retrained on randomised in-hand offsets (+-7 mm sideways, 0..+4 mm up), force vs no force", "result": "randomised in-hand offsets, 6 seeds each, 50 set-ups: force 0.74 0.56 0.66 0.50 0.62 0.64 (mean 0.620 +- 0.083), no force 0.44 0.54 0.52 0.60 0.60 0.46 (0.527 +- 0.068); Welch p = 0.06, Mann-Whitney p = 0.07 (same direction as the centred-grasp result, weaker with 6 seeds). Sequencer, no-force pair (pick noforce_s0, insert grand noforce_s3), 10 noisy episodes: 1/10 complete, 14/60 parts, pick 34/43, insert 11/31 (was 0/12). Force-pair sequencer running: outputs/seq_force_grand | force-pair sequencer (pick force_s2, insert grand force_s0): 0/10 complete, 7/60 parts, pick 20/20, insert 7/19 - insert ~35-37 % after learned picks for both pairs (single pairs: too noisy to compare conditions)", "verdict": "kept", "runs": "outputs/td3_sort_grand", "note": "fix for the composition failure (learned pick leaves the bolt 3-7 mm off centre); expert knob grasp_dy (default 0), SortInsertEnv(grasp_rand), TD3 --grasp-rand. The randomisation reproduces the offsets but not the up-to-12 deg tilt of the learned pick (tilt stays < 1 deg). Then re-run the sequencer."}
{"ts": "2026-10-01T17:40", "id": "V6-centred", "kind": "experiment", "title": "V6 pick skill with a grasp-quality criterion (centred: head < 2.5 mm off the pad centre, tilt < 5 deg)", "result": "final on 50 set-ups (best checkpoint): force 0.54 0.60 0.50 0.48 0.36 0.44 (mean 0.487), no force 0.50 0.36 0.30 0.48 0.46 0.48 (mean 0.430) - the centred criterion is much harder than 'held' (~99 %); force slightly ahead (tactile CoP measures the in-hand offset). Sequencers with the best centred pick + offset-robust insert (force and no force) running | sequencers (10 noisy episodes each): force (centred pick force_s1 + insert grand force_s0) 0/10, 12/60 parts, pick 19/28, insert 11/18 (61 %, was 37 % after unconstrained picks); no force (centred noforce_s0 + grand noforce_s3) 0/10, 14/60 parts, pick 37/42, insert 9/32 (28 %)", "verdict": "kept", "runs": "outputs/td3_pick_centred", "note": "attacks the sequencer bottleneck at its source: insert after a learned pick is ~35 % even with the offset-randomised insert skill, vs 62 % in its own set-ups. Opt-in (SortPickEnv(centred), TD3 --centred)."}
{"ts": "2026-10-01T19:30", "id": "V6", "kind": "milestone", "title": "V6 done: TD3+BC skills reported, sequencer full sort reported", "result": "insert (centred grasps, 10 seeds each): force 74.8 % vs 56.2 % (p = 0.0005); insert on randomised in-hand offsets (6 each): 62.0 % vs 52.7 % (p = 0.06); pick (held): 99.0 % vs 99.6 % (ceiling); pick (centred): 48.7 % vs 43.0 %. Full sort with the scripted sequencer: 0-1 of 10 episodes, 7-14 of 60 parts; best composition: centred force pick + offset-robust force insert -> insert after a learned pick 61 %", "verdict": "kept", "note": "gate = 'skill success on 10 seeds each; full-sort success with the sequencer' - reported (insert and held-pick at 10 seeds; the composition experiments at 6). Force helps where contact matters (insertion, centring a grasp); composing separately trained skills is the bottleneck for the full sort."}
{"ts": "2026-10-01T20:30", "id": "V9a", "kind": "experiment", "title": "V9 at skill level: BC of the insertion skill with vs without force/tactile (scripts/30_bc_insert.py)", "result": "BC on 300 expert insertion demos (187 successful, 29511 pairs), MLP, 5 seeds each, 50 unseen set-ups with randomised in-hand offsets: WITH force/tactile 0.24 0.32 0.30 0.28 0.30 (mean 0.288), WITHOUT 0.08 0.12 0.06 0.06 0.02 (mean 0.068); Welch p < 0.001, Mann-Whitney p = 0.012. Outcomes over 250 episodes: force 72 success / 174 timeout / 3 dropped / 1 abort; no force 17 / 229 / 4", "verdict": "kept", "runs": "outputs/bc_insert", "note": "whole-task ACT / SmolVLA reach 0 parts, so a force vs no-force comparison there would be 0 vs 0; the plan's V9 claims (insertion success, grasp, false seated) are tested where they live. Demos are the expert's own non-privileged insertion (aim at its estimate, contact > 20 N -> spiral), so they contain force-driven decisions; labels = pad displacement per step. | 9 parallel runs stalled for ~75 min (host load ~137 on 24 cores: torch's default thread count per container); killed, torch.set_num_threads(2), relaunched from the cached demos. | force more than quadruples imitation success: the demos contain contact-driven decisions (stop, search), which a force-blind imitator cannot condition on."}
{"ts": "2026-10-01T21:40", "id": "V9b", "kind": "step", "title": "TA-SmolVLA: torque token in SmolVLA's action-expert suffix (src/fvb/vla/ta_smolvla.py)", "result": "test passes on smolvla_base (GPU): loss finite, gradient reaches the torque MLP, changing the torque history changes the predicted chunk, the token input is cleared after each call", "verdict": "kept", "note": "10 x 15 torque history -> MLP -> one token of the expert width prepended to the suffix (actions attend to it; loss / denoiser read only the last chunk_size positions). zero_token=True is the no-force twin with identical parameters. Not yet: TA-VLA's auxiliary torque-prediction loss, and a training run - whole-task SmolVLA reaches 0 parts, so its force twin would compare 0 vs 0; a skill-level VLA dataset (insertion episodes with images) would be needed."}
{"ts": "2026-10-02T00:20", "id": "V10a", "kind": "step", "title": "V10: evaluation matrix with 95 % intervals (scripts/31_stage2_matrix.py -> docs/stage2/matrix.{json,md}) + README Stage 2 section", "result": "insert TD3+BC 74.8 % [67.4, 80.4] vs 56.2 % [51.6, 60.2] (p = 0.0005); insert TD3+BC offsets 62.0 [56.0, 68.0] vs 52.7 [47.7, 57.7] (p = 0.06); pick held 99.0 vs 99.6 (ns); pick centred 48.7 vs 43.0 (ns); BC insert 28.8 [26.4, 30.8] vs 6.8 [4.0, 10.0] (p = 8e-6); full sort <= 1/10 episodes, insert after a learned centred pick 11/18 [39-80 %] with force vs 9/32 [16-45 %] without", "verdict": "kept", "note": "seed-level bootstrap intervals + pooled Wilson intervals in matrix.json. Remaining for V10: the Stage 2 HTML report (videos, curves). Whole-task cells (ACT / SmolVLA 0 parts) are reported in FINDINGS rather than as matrix rows."}
{"ts": "2026-10-02T01:30", "id": "V10b", "kind": "step", "title": "V10: Stage 2 report (docs/stage2/index.html, published https://claude.ai/artifact/Rxjx4uAwPy7mVhNDS9j3se)", "result": "setup, force-vs-no-force matrix with 95 % intervals, TD3 insertion learning curves (10 seeds per condition), videos (rack expert full episode; TD3 insertion with vs without force on the same set-ups), failures, open decisions; media by scripts/32_stage2_media.py", "verdict": "kept", "note": "V10 open items: README placement, the two pending user decisions. V9's TA-SmolVLA is built but not trained (needs a skill-level image dataset)."}
{"ts": "2026-10-02T02:40", "id": "V9c", "kind": "experiment", "title": "V9 TA-SmolVLA at skill level: recording 240 insertion demos with images (scripts/33_record_insert_demos.py)", "result": "240 set-ups recorded, 158 successful (tip >= 8 mm); converted to outputs/lerobot/insert_ta (158 ep, 10778 frames, force features kept)", "verdict": "kept", "runs": "outputs/insert_demos", "note": "plan: convert successful episodes (--mode episode --only-success, keep torque_hist), fine-tune smolvla_base three ways - plain, TA (torque token), TA with the token zeroed (no-force twin, identical parameters) - and evaluate closed loop in the insert env through the policy server. Actions = pad displacement (dims 0-2)."}
{"ts": "2026-10-02T04:10", "id": "V9d", "kind": "experiment", "title": "V9 TA-SmolVLA fine-tunes on 158 successful insertion demos (local/insert_ta, 10778 frames): TA vs TA-zeroed-token vs plain SmolVLA", "result": "smoke 50 steps OK (loss 0.88->0.65, torque_mlp saved in checkpoint); full runs 10k steps, batch 8, ~85 min each; ta + ta_zero concurrently (~4 GB GPU each), then off; server gained --ta {off,ta,ta_zero} | finished: all three fine-tunes trained 10k steps and were evaluated on 100 held-out set-ups (plain 61, zeroed 66, raw TA 53)", "verdict": "kept", "outputs": "outputs/ta_ta, outputs/ta_ta_zero, outputs/ta_off (logs outputs/ta_*.log, chain outputs/diag/ta_train_pipeline_run.sh)"}
{"ts": "2026-10-02T05:15", "id": "V9e", "kind": "step", "title": "V9 skill-level closed-loop image eval (fvb/vla/skill_eval.py, scripts/35_eval_insert_skill.py) + server --n-action-steps / --device cpu, torque_hist passed to TA checkpoints", "result": "tests/test_skill_eval.py 2 passed (expert through the policy interface inserts; zero policy times out); torque_hist verified in the training batch after the pre-processor (150-D, unnormalised); smoke: step-5000 TA checkpoint served on CPU inserted 1/2. Auto-eval chain queued: 100 held-out set-ups (800000+s) per fine-tune, re-plan every 10 steps | finished: all three fine-tunes trained 10k steps and were evaluated on 100 held-out set-ups (plain 61, zeroed 66, raw TA 53)", "verdict": "kept", "outputs": "outputs/eval_ta_insert/{ta,ta_zero,off} (chain outputs/diag/ta_eval_chain.sh)"}
{"ts": "2026-10-02T06:20", "id": "V9f", "kind": "experiment", "title": "V9 result: TA-SmolVLA (raw torque token) vs zeroed-token twin, insertion skill, 100 held-out set-ups each", "result": "TA 53/100 (Wilson 95 % [43, 63]) vs zeroed 66/100 [56, 75]; Fisher p = 0.084, paired by set-up 3 TA-only vs 16 zeroed-only successes, sign test p = 0.004; all failures are timeouts (no force aborts, no drops). Demonstrator on the demo set-ups: 66 %. The raw token HURTS. Suspected cause: unnormalised input, the tactile grip force (~47 N, std 19) swamps the joint torques (~1 N). One training seed per arm.", "verdict": "failed", "outputs": "outputs/eval_ta_insert/{ta,ta_zero}"}
{"ts": "2026-10-02T06:25", "id": "V9g", "kind": "experiment", "title": "V9 fix attempt: TA_MODE=ta_norm, torque history z-scored with the dataset stats (buffers saved in the checkpoint), behind a flag", "result": "ta_norm 43/100 (Wilson [34, 53]); vs zeroed twin 4 vs 27 discordant (sign p = 3e-5), vs plain 5 vs 23 (p = 0.001): normalising made it worse. Torque token switched off (TA_MODE=off is the default for SmolVLA; ta/ta_norm kept opt-in for the record)", "verdict": "failed", "outputs": "outputs/ta_ta_norm, outputs/eval_ta_insert/ta_norm (chain outputs/diag/ta_norm_chain.sh)"}
{"ts": "2026-10-02T08:40", "id": "V9", "kind": "milestone", "title": "V9 closed: force vs no-force twins at skill level", "result": "TD3 insert 74.8 vs 56.2 % (p = 0.0005), BC insert 28.8 vs 6.8 % (p < 0.001): force helps; TA-SmolVLA torque token hurts the image-based insertion skill (raw 53 %, z-scored 43 % vs zeroed 66 %, plain 61 %; zeroed vs plain p = 0.36). PLAN \u00a713 status, FINDINGS and docs/stage2/matrix updated; dev suite 71 passed, 4 skipped", "verdict": "kept", "outputs": "docs/stage2/matrix.md, outputs/eval_ta_insert"}
