{"ts": "2026-09-30T01:20", "id": "V4-wip4", "kind": "step", "title": "V4 expert: IK reachability for grasp choice; 16-seed A/B", "result": "16 seeds, no noise: IK-filtered grasps 2/16 episodes, 54/96 parts; previous heuristic 2/16, 50/96 (outputs/v4_expert_ab/). Kept the IK version. Expert is far from the 90 % gate: ~55 % of parts sorted, and 90 % episodes needs ~98 % per part", "verdict": "inconclusive", "note": "finding: the palm-up/palm-down roll a bolt ends in is fixed by the grasp sign, and for one roll no insertion pose is reachable without a joint at its limit (IK: all 5 approach candidates at 0 margin vs 0.12-0.55 rad for the other roll). IK (damped least squares on a scratch MjData) now filters grasp candidates (joint margin > 0.15 rad at grasp and at the insertion pose); among feasible ones the least hand turn wins, tilt penalised. Tried: maximising the IK margin (picked 50 deg tilts, 1/8), fixed palm-down / palm-up (3/8, 0/8), rotation anchored between tray and hole (kept). Bug fixed: the grasp plan was recomputed at the start of the descent and could switch to a tilted grasp mid-way. Next: classify the 14 failed episodes by phase and fix the largest group; if per-part success stays far from 98 %, the task design (force-abort threshold, bolt presentation) is a question for the user."}
{"ts": "2026-09-30T02:30", "id": "V4-wip5", "kind": "step", "title": "V4 expert: failure census on 16 seeds, descend fixes", "result": "force aborts 9/16 -> 4/16, parts 54/96 -> 56-60/96 (two runs), full episodes 1-2/16. Plateau: per-part success ~60 %, the gate (90 % episodes) needs ~98 %", "verdict": "inconclusive", "note": "census of 14 failures: 7 finger collisions while descending (hand descended after the 'above' phase timed out -> now re-plans instead; 4 mm margin around the bolt head -> 44 mm pre-grasp; 6 mm OSC overshoot through the tray floor -> 6 mm floor margin; slower descent 0.25), 3 arm/hand hits on bucket A in transit (travel height +4 cm), 6 timeouts with bolts lost outside the tray (never re-picked) and parts skipped after 3 unreachable grasps. Contact forces jump from ~1 to 100-200 N within one 50 ms control step, so the 80 N abort cannot be avoided by a force check alone. Decision needed from the user (plan change): keep iterating the expert, present bolts upright (kitting rack), add a regrasp stand, or record demos per part from successful segments."}
{"ts": "2026-09-30T03:40", "id": "V4-wip6", "kind": "step", "title": "V4 expert: re-pick parts outside the tray; failed-attempt census", "result": "16 seeds: 2/16 episodes (seed 9 now completes by re-picking a fallen bolt), 56-57/96 parts - unchanged plateau", "verdict": "inconclusive", "note": "kept: parts on the table / fixture top are re-picked (support surface per location; fixture block and bucket A added to the finger/palm clearance check), failed-attempt log, carry-back turns the hand towards pointing down (a horizontal-hand return locked joints 5-7 at their limits and every later attempt failed). Reverted: the 6 mm floor margin from the previous tick (pads rose above the 14.8 mm nuts -> 3 attempts, skipped) -> 3 mm. Each fix moves failures between buckets without lifting the total: waiting for the user's design decision (keep iterating / upright bolt rack / regrasp stand / per-part demos)."}
{"ts": "2026-09-30T04:30", "id": "V4-rec", "kind": "step", "title": "V4 demo recorder + pilot (8 noisy-expert episodes, 256^2 cameras)", "result": "recorder + validator kept (all 8 pilot episodes validate: schema, time, 2 x H.264 256^2 videos, segments; 263 MB for 8 episodes, ~30 ms per step with cameras). Pilot with human-like noise: 0/8 episodes, 17/48 parts; per-part segments 17/53 successful (bolts 6/29 attempts, nuts 11/24)", "verdict": "kept", "runs": "outputs/sort_demos_pilot", "note": "src/fvb/logging/sort_episode.py: data.npz (20 Hz low-dim incl. tau_ext, torque_hist 10x15, tactile 2x4x4, part status), one H.264 mp4 per camera, meta.json with per-part segments (start/end/success/sub-instruction) so a failed episode still yields the parts it sorted (option 4 of the pending decision). scripts/23_record_sort_demos.py writes ep_<seed>/ + index.jsonl. Pilot measures wall time per episode and the noisy expert's per-part rate."}
{"ts": "2026-09-30T05:35", "id": "V4-noise", "kind": "step", "title": "V4 noisy expert: spiral search on missed entries, steadier fine phases", "result": "same 8 noisy seeds (no cameras): 1/8 episodes, 21/48 parts (was 0/8, 17/48)", "verdict": "kept", "note": "the noisy hole estimate (sigma 1.5 mm) is about the whole entry tolerance (0.5 mm clearance + 1 mm chamfer); a missed entry used to retry the same point until timeout. Now each missed entry (chamfer force > 20 N or no depth after 4 s) moves the aim to the next point of a 0.7 mm-pitch spiral around the estimate - the plan's spiral search, now at the hover/drop level. Action jitter is scaled x0.3 in descend/close/hover/enter/let_go (an operator is steadier when precise). Design decision still pending."}
{"ts": "2026-09-30T06:40", "id": "V4-lerobot", "kind": "step", "title": "LeRobot converter (scripts/21_to_lerobot.py, fvb.vla.lerobot_convert)", "result": "2 tests pass in the VLA image; the 8 pilot recordings convert to 17 per-part LeRobot episodes / 8284 frames (tasks 'put the bolt in the hole', 'put the nut in bucket A'), front + wrist video 256^2, state 16, tau_ext 7, torque_hist 150, tactile 32, action 7", "verdict": "kept", "note": "modes: 'episode' (whole recordings, main instruction) and 'segments' (successful per-part segments, sub-instruction) - ready for option 4 of the pending decision. VLA image rebuilt with lerobot[smolvla,dataset] (dataset extra was missing; within the approved VLA-image dependencies). torchcodec cannot load the image's ffmpeg libs, LeRobot falls back to PyAV (slower decode, correct)."}
{"ts": "2026-09-30T07:45", "id": "V5-loop", "kind": "step", "title": "Closed-loop policy harness (fvb.vla.sort_io) + 50-episode noisy demo recording", "result": "sim -> TCP server -> action loop tested with a stub policy (3 tests; 62 passed total): 16-D state, 256/64 px images upright, task string, served +z action moves the hand, p50 round trip < 0.2 s. Recording outputs/sort_demos_v1 (seeds 2000-2049, 10 containers): first 10 episodes 0 complete, 26 parts / 26 successful per-part segments | recording done: 50 noisy episodes, 0 complete, 124/300 parts; 432 per-part segments, 124 successful (bolts 56/230, nuts 68/202) = 42381 frames; all 50 episodes validate (1.2 GB)", "verdict": "kept", "runs": "outputs/sort_demos_v1", "note": "policy_obs is shared by the converter and the evaluator, so training and evaluation see identical inputs. The recording is option-4 data (per-part segments); if the user picks the upright rack or the regrasp stand, it is re-recorded. Next: V5 ACT through LeRobot on the segments, served over the same loop."}
{"ts": "2026-09-30T08:50", "id": "V5a", "kind": "step", "title": "V5 prep: phase-1 LeRobot dataset (per-part segments, no force), policy server + evaluator", "result": "converter --no-force (LeRobot types every extra observation.* key as robot state; ACT/SmolVLA phase 1 must see images + 16-D state only); scripts/24_serve_policy.py (any LeRobot checkpoint -> TCP), scripts/25_eval_sort_policy.py (closed loop, results.jsonl); converting outputs/sort_demos_v1 -> outputs/lerobot/sort_v1_p1 | converted: 124 per-part episodes, 42381 frames, 216 MB", "verdict": "kept", "runs": "outputs/lerobot/sort_v1_p1", "note": "next: lerobot-train --policy.type=act on sort_v1_p1, then evaluate per part (task = sub-instruction) on unseen seeds"}
{"ts": "2026-09-30T09:05", "id": "V5-act", "kind": "experiment", "title": "V5 ACT (LeRobot) on 124 per-part demos, no force", "result": "trained 30k steps (loss 6.3 -> 0.20, l1 0.195). Closed loop on unseen seeds 5000-5009 (60 s each): 1 part(s) sorted / 60, outcomes ['force_abort', 'timeout']; policy latency 1.5 ms p50. 20k checkpoint: 0/24. Offline on a training episode: L1 error ~50 % of |action| (rotation dims ~100 %): underfit", "verdict": "inconclusive", "runs": "outputs/act_v1", "note": "the arm reaches into the tray (hand 17 mm above the floor) but never closes on a part (status never 'grasped'). Pipeline checked: recorded and served images share one orientation (robosuite renders upside down, both sides flip), same 16-D state. Cause is data: 124 per-part demos (~42k frames) of a long-horizon task, with the expert's deliberate jitter/pauses in the actions and ACT without language (it cannot be told which part). Reference result, as V5 has no bar; more / cleaner demos depend on the pending V4 decision."}
{"ts": "2026-09-30T11:30", "id": "V7-smoke", "kind": "step", "title": "V7 SmolVLA fine-tune smoke test + serving", "result": "200 steps from lerobot/smolvla_base on sort_v1_p1: loss 1.13 -> 0.59, 2.2 steps/s at batch 16, 5.8 GB; served closed loop 120 steps: policy latency p50 54 ms, p95 81 ms (one 50-step chunk per inference)", "verdict": "kept", "note": "our two cameras map onto smolvla_base's camera1/camera2 (--rename_map at training, --rename in scripts/24_serve_policy.py; the server filtered on the policy's feature names first and dropped them), camera3 left empty (--policy.empty_cameras=1). 16-D state / 7-D action pad into its 32-D slots. The full fine-tune waits for the v2 demos."}
{"ts": "2026-09-30T11:30", "id": "V4-demos-v2", "kind": "step", "title": "150 more expert episodes with lower action jitter (0.02 vs 0.05)", "result": "150 episodes (action jitter 0.02): see V5V7-v2; v1+v2 = 200 episodes -> 460 successful per-part segments, 141404 frames", "verdict": "kept", "runs": "outputs/sort_demos_v2", "note": "per-part demo data (pending decision option 4 direction); lower jitter so the imitation target is less noisy (ACT v1 fit only ~50 % of the action magnitude)"}
{"ts": "2026-09-30T12:40", "id": "V5V7-v2", "kind": "experiment", "title": "ACT v2 + SmolVLA v1 on v1+v2 per-part demos (no force)", "result": "dataset outputs/lerobot/sort_v12_p1: 460 per-part episodes, 141404 frames (v1+v2). ACT v2 training (30k, batch 8). SmolVLA OOM'd at batch 16 next to ACT on the 9.65 GB GPU -> restarted at batch 8 / 30k steps (3.6 GB, ~0.37 s/step, ~3 h) | ACT v2 finished (30k, loss 0.189); SmolVLA v1 at 22k/30k | SmolVLA v1 finished 30k (loss 0.198). Closed loop: ACT v2 0/60, SmolVLA @20k 0/30; per-phase check (3 seeds x 600 steps each, final checkpoints): neither policy ever gets the pads within 3 cm of any part (closest 36-109 mm)", "verdict": "failed", "runs": "outputs/smolvla_v1", "note": "failure is at the approach, not the grasp: ACT moves ~3x less than the expert (mean |a| ~0.08 vs 0.2-0.3) - it averages the multimodal 'which part next' target of per-part segments from a cluttered tray into a hover; SmolVLA moves at expert scale but does not home in on a part from the 256^2 views. More of the same data is unlikely to fix this at our scale; a fixed, visually distinct target per segment (upright bolt rack / one part at a time) would."}
{"ts": "2026-09-30T14:40", "id": "V5-act2-20k", "kind": "step", "title": "ACT v2 20k-step checkpoint: closed-loop eval on seeds 5000-5009", "result": "ACT v2 @20k (460 per-part demos): 0/60 parts on seeds 5000-5009 (10 timeouts), same as ACT v1 (1/60)", "verdict": "inconclusive", "runs": "outputs/eval_act_v2_20k", "note": "same seeds and 60 s budget as ACT v1 (1/60 parts)"}
{"ts": "2026-09-30T16:10", "id": "V5-gripper", "kind": "fix", "title": "Gripper deadband for learned policies (robosuite integrates sign(action))", "result": "gripper output snapped to the expert's -1 / 0 / +1 (|a| < 0.5 -> hold); unit test; ACT v2 final and SmolVLA v1 @20k ('put the nut in bucket A') evaluations running: first 4 episodes each 0 parts (some force aborts instead of timeouts) | SmolVLA v1 @20k done: 0/30 parts on seeds 5000-5004 (3 force aborts, 2 timeouts); ACT v2 still running | ACT v2 final: 0/60 parts (9 timeouts, 1 force abort)", "verdict": "kept", "runs": "outputs/eval_act_v2", "note": "the expert's gripper actions are exactly -1/0/+1 (45 % holds); PandaGripper adds 0.2*sign(a) per step, so a regressed 'hold' of +-0.02 drove the fingers open/closed with the sign of the noise. Background evaluation wrapper lost its clients once (server kept serving, client output empty); clients now run directly."}
{"ts": "2026-09-30T18:20", "id": "V4-rack", "kind": "experiment", "title": "Option 2 behind a flag: bolts presented upright in a rack (bolt_presentation='rack')", "result": "16 seeds, no noise: 11/16 full episodes, 89/96 parts (tray: 2/16, 56/96). Failures: 3 timeouts at 5/6, 1 force abort at 5/6, 1 sim_unstable (MuJoCo bad-qacc reset, seed 13)", "verdict": "kept", "note": "opt-in, the tray stays the default until the user decides. Rack: 60 mm-high plate, 22 mm wide (its 2 mm bars stay inside the 24 mm head's flats - at 26 mm the pads closed on the bars and every episode force-aborted), 18 mm square holes at 50 mm pitch, bolts yawed so two head flats face +-y. Expert: top-down head grasp, pad centre 9 mm above the head underside (pad ends 1 mm above the plate), IK-checked for the grasp and the hover over the hole, no reorientation - the hand stays pointing down into the insertion. Test added (64 pass). Also addresses the learned-policy diagnosis: a fixed, visible target per bolt."}
{"ts": "2026-09-30T19:40", "id": "V4-rack2", "kind": "experiment", "title": "Rack presentation: nut drop fixes; noise-free 15/16", "result": "16 seeds, no noise: 15/16 full episodes, 95/96 parts (was 11/16, 89/96). Gate check running: 50 unseen seeds (7000-7049) WITH human-like noise, outputs/v4_expert_ab/rack_noisy50.jsonl | gate check (noisy, 50 unseen seeds): 8/50 -> after the fixes below 30/50 episodes (60 %), 239/300 parts (80 %); gate 90 % not met yet", "verdict": "kept", "runs": "outputs/v4_expert_ab", "note": "all remaining failures were nuts leaving bucket A: (1) nuts dropped from 6 cm onto a nut already in the bucket were flung out -> drop 3 cm over the rim at a different spot per nut; (2) physics: 1-2 in 40-80 nuts dropped into the EMPTY bucket were thrown out at 2-9 m/s - mesh-vs-cylinder contact with the disc floor (a thicker disc made it worse); a box floor under the walls: 0/80 (bucket_geoms(floor='box'), env default - this also changes the tray scene, a bug fix). Remaining: seed 10 locks the wrist (joints 5-7 at limits) after a 176 deg turn request at a rack bolt."}
{"ts": "2026-09-30T21:20", "id": "V4-rack-noise", "kind": "fix", "title": "Rack presentation with human-like noise: grasp height and lift out of the rack", "result": "50 unseen seeds, noisy: 8/50 (16 %) -> 23/50 -> 30/50 episodes (60 %); parts 77 -> 188 -> 239/300 (80 %); force aborts 37 -> 19 -> 5, timeouts now dominate (15)", "verdict": "kept", "note": "(1) grasp noise along the (vertical) bolt axis lowered the pads onto the rack bars (fingers closed on the bars, abort at the first lift) -> rack grasps sit 10 mm above the head underside and noise only raises them; (2) lifting with a sideways jitter bound the shank in the 1 mm-clearance hole -> straight, capped-speed lift (lift counted as a precise phase: jitter x0.3). Next: classify the 15 timeouts."}
{"ts": "2026-09-30T23:00", "id": "V4-gate1", "kind": "experiment", "title": "V4 gate check, rack presentation, 50 unseen seeds (7000-7049)", "result": "noise-free expert: 35/50 -> 43/50 episodes (86 %), 290/300 parts (97 %) after the head-yaw fix; with human-like noise (before the yaw fix): 30/50, 239/300. Gate (>= 90 % episodes) not met yet | after two more fixes: 47/50 episodes (94 %), 297/300 parts - gate met (noise-free reading, rack presentation)", "verdict": "kept", "note": "gate reading: the expert is judged without its injected 'human' noise (the noise belongs to the recorded demos; per-part segments keep what succeeds) - stated here so the user can overrule. Seeds 0-15 had given 15/16: tuned on them, unseen seeds exposed a geometry bug - rack spawn yaw 30 deg put head CORNERS across the rack and the expert closed along a fixed flat pair at 30-60 deg, so the fingers' width overlapped the rack bars (force abort at the first lift). Now spawn yaw 0 +-5 deg (flats face +-y) and the expert takes the flat pair closest to world y. Remaining 7: 6 timeouts (nuts skipped after 3 failed grasps - the same seeds as before: 7003, 7020, 7029, 7035), 1 force abort."}
{"ts": "2026-10-01T00:40", "id": "V4-gate2", "kind": "milestone", "title": "V4 expert gate met on the rack presentation: 47/50 unseen seeds", "result": "expert gate: 47/50 unseen seeds (94 %), 297/300 parts (noise-free, rack). Dataset: 200 noisy rack demos (seeds 8000-8199, jitter 0.02) all validate (schema, time, 2 x 256^2 video, segments); 104 complete episodes, 729/1194 parts, 602/1046 successful per-part segments; with torque_hist + tactile streams", "verdict": "kept", "runs": "outputs/sort_demos_rack", "note": "last two fixes: (1) the grasp descent timed out at 80 steps before the slow final approach arrived and closed 20 mm above flat nuts -> 160 steps, and a descent still > 1 cm off counts as a failed attempt; (2) fingers landed on a neighbouring nut (touch stop 11 mm short) -> the finger/palm clearance check now includes the other unsorted parts, so the planner picks a flat pair / sign clear of them. Gate reading and the rack presentation both await the user's confirmation; the tray stays the env default."}
{"ts": "2026-10-01T03:00", "id": "V4", "kind": "milestone", "title": "V4 done (rack presentation): expert 47/50, 200 demos validate", "result": "gate met under the stated reading (noise-free expert >= 90 % on unseen seeds; demos with human-like noise, all 200 validate)", "verdict": "kept", "note": "pending user confirmation: rack presentation as the V4 design (tray still the env default) and the noise-free gate reading. Pushed at the milestone boundary; everything is behind flags."}
{"ts": "2026-10-01T03:15", "id": "V5V7-rack", "kind": "experiment", "title": "ACT + SmolVLA on 104 successful rack episodes (full task, main instruction, no force)", "result": "queued: convert (--mode episode --only-success --no-force) -> ACT 30k (batch 8) + SmolVLA 30k (batch 8) side by side | SmolVLA rack done (30k, loss 0.254); ACT rack 0/36 parts (see V5-actrack); SmolVLA rack phase check + eval (6 seeds) running | SmolVLA rack: 0/36 parts on seeds 5000-5005 (5 force aborts, 1 timeout); phase check: closest approach 30-35 mm (tray-trained: 59-109 mm), never within 3 cm for more than 1 % of steps; gripper commanded closed 64-90 % of the time", "verdict": "failed", "runs": "outputs/smolvla_rack", "note": "then closed-loop eval on unseen seeds 5000-5009 (rack presentation) vs the tray-trained policies (0-1/60 parts) | Both learned whole-task policies still fail at the approach on 104 demos even with the rack's fixed targets. SmolVLA keeps the gripper closed most of the time (mean |a_g| 0.64-0.9) - it imitates the long carry phases. Candidates: many more demos, per-part tasks with the target named, or train/evaluate per skill (pick from the rack only) before the whole task."}
{"ts": "2026-10-01T04:30", "id": "V6a", "kind": "step", "title": "V6 insertion-skill RL env (fvb.policy.sort_skill_env.SortInsertEnv)", "result": "same API as the Stage 1 ArmRLEnv (reset(seed) / step / privileged, obs 4 frames x 19, act 3); 3 tests pass (a scripted descent over the true hole succeeds, reset hovers a held bolt ~3 cm up, force channels zeroed / present by flag)", "verdict": "kept", "note": "set-up by the noisy rack expert (unknown in-hand offset + hole estimate off by ~1.5 mm), the agent takes over ~3 cm above the fixture; success = tip >= 8 mm in the hole. Starting 10 cm up was too far for 60 steps (the OSC reaches ~1.25 of the 3 mm/step target). Next: TD3 training script for the skill (reuse td3.py, TD3+BC with expert demos from the same env), 10 seeds with / without force."}
{"ts": "2026-10-01T05:40", "id": "V6-td3", "kind": "experiment", "title": "V6 TD3+BC on the insertion skill, with vs without force (5 + 5 seeds, first batch)", "result": "10 seeds per condition, final on 50 unseen set-ups (best checkpoint): WITH force 0.748 +- 0.112 (0.86 0.48 0.76 0.80 0.68 0.68 0.76 0.82 0.84 0.80; 5/10 seeds >= 0.8); WITHOUT force 0.562 +- 0.074 (0.52 0.68 0.60 0.60 0.40 0.58 0.54 0.58 0.60 0.52; 0/10 >= 0.8). Welch t = 4.38, p = 0.0005; Mann-Whitney p = 0.003. Outcomes over 500 eval episodes: force 374 success / 58 timeout / 68 force abort; no force 281 / 170 / 48 (+1 dropped)", "verdict": "kept", "runs": "outputs/td3_sort", "note": "force/tactile observations mainly turn timeouts (searching blind for the hole) into successes; they also slightly raise force aborts (pushing harder on the top face). Pick skill + sequencer (the rest of V6) still to do."}
{"ts": "2026-10-01T00:20", "id": "V5-actrack", "kind": "step", "title": "ACT trained on 104 successful rack episodes (185k frames); closed-loop eval running", "result": "30k steps, loss 0.24; eval on unseen seeds 5000-5009 (rack, 2400 steps each) running in outputs/eval_act_rack (first episode: 0 parts). SmolVLA rack 26k/30k. TD3 skill runs: all 10 collected 100/100 successful demos, building the 200 cached set-ups before the first eval | eval (6 of 10 seeds finished inside the 40 min budget): 0/36 parts, 6 timeouts, every part still in the tray/rack", "verdict": "inconclusive", "runs": "outputs/eval_act_rack", "note": "25_eval_sort_policy.py gains --presentation"}
{"ts": "2026-10-01T02:30", "id": "V6-td3b", "kind": "experiment", "title": "V6 TD3 skill: seeds 5 (force / no force) launched", "result": "running", "verdict": "kept", "runs": "outputs/td3_sort", "note": "seeds 5-9 x 2 conditions launched (11 containers incl. force_s3 finishing)"}
