{"ts": "2026-09-24T23:00", "id": "S0", "kind": "milestone", "title": "Stage 0 (M0\u2013M6) reproduced", "change": "make all on a clean build; 14 tests", "result": "All F/T sensing findings reproduced; report docs/report", "verdict": "kept", "commit": "3349da9"}
{"ts": "2026-09-25T00:10", "id": "S1.3a", "kind": "experiment", "title": "Arm expert: gantry descent speed (50 mm/s)", "hypothesis": "the gantry expert transfers unchanged", "result": "6 of 8 probe episodes hit the 60 N abort on first rim contact (OSC lag ~15 mm)", "verdict": "reverted", "commit": "34a22bc"}
{"ts": "2026-09-25T00:20", "id": "S1.3b", "kind": "fix", "title": "Two-speed approach (10 mm/s near the rim)", "result": "expert 299/300", "verdict": "kept", "commit": "34a22bc"}
{"ts": "2026-09-25T02:00", "id": "S1.4a", "kind": "fix", "title": "Wrench torque about the peg tip instead of the flange", "hypothesis": "a lever-arm term (corr 0.83 with -0.1\u00b7Fx) hides the x-direction cue", "result": "x cue 54% -> 78%; BC MLP + F/T 13/50 -> 39/50", "verdict": "kept", "commit": "34a22bc"}
{"ts": "2026-09-25T02:10", "id": "S1.4b", "kind": "experiment", "title": "Anti-windup: freeze xy integrator in contact", "hypothesis": "the 8 N lateral force is integrator wind-up", "result": "8 N unchanged: not the cause (source still open)", "verdict": "kept", "note": "harmless, kept on; hypothesis rejected", "commit": "34a22bc"}
{"ts": "2026-09-25T03:00", "id": "S1.4c", "kind": "experiment", "title": "ACT-lite on the arm: H 16/20, lr 1e-4, 250 epochs", "hypothesis": "history or optimisation budget makes ACT-lite use force", "result": "val loss plateau 0.102-0.105 in every variant, = no-force", "verdict": "reverted", "commit": "34a22bc"}
{"ts": "2026-09-25T03:30", "id": "S1.5a", "kind": "experiment", "title": "kp randomisation with delta actions", "hypothesis": "randomising kp makes the gantry policy stiffness-robust", "result": "collapsed to ~10%: one-step corrections regress to 1% of their size", "verdict": "reverted", "commit": "34a22bc"}
{"ts": "2026-09-25T03:40", "id": "S1.5b", "kind": "experiment", "title": "Observe log(kp); expert corrects at the jam step", "hypothesis": "the collapse is hidden timing", "result": "neither helped (val 0.189; 5/50)", "verdict": "reverted", "commit": "34a22bc"}
{"ts": "2026-09-25T04:00", "id": "S1.5c", "kind": "experiment", "title": "xy_abs actions (lateral target as a position)", "result": "kp-random 10% -> 54-92%, but nominal 100% -> 80-92%", "verdict": "kept", "note": "kept as an option, not the default", "commit": "34a22bc"}
{"ts": "2026-09-25T12:00", "id": "RL0a", "kind": "experiment", "title": "TD3 baseline, first batch", "result": "'96-100%' successes were reward hacking: peg lowered onto the table beside the hole block", "verdict": "reverted", "note": "results retracted", "commit": "fb4ca61"}
{"ts": "2026-09-25T12:30", "id": "RL0b", "kind": "fix", "title": "Success requires the tip over the hole opening", "result": "regression tests on both tasks; BC numbers re-evaluated identically", "verdict": "kept", "commit": "1582a03"}
{"ts": "2026-09-25T14:00", "id": "RL0c", "kind": "experiment", "title": "TD3 baseline, corrected (5 seeds x F/T, no F/T)", "result": "F/T 9,6,0,49,0 /50; no F/T 4,9,1,0,8 /50 -> 1 of 5 seeds learns", "verdict": "kept", "note": "baseline for G5", "runs": "outputs/s1_td3", "commit": "bbe5dc6"}
{"ts": "2026-09-29T09:20", "id": "R1-fix", "kind": "fix", "title": "TD3+BC: floor the |Q| normaliser at 1.0", "hypothesis": "found by a unit test: near-zero |Q| early on turns the Q term into amplified noise", "result": "BC test passes; 25 tests green", "verdict": "kept"}
{"ts": "2026-09-29T09:31", "id": "R1", "kind": "experiment", "title": "TD3 + 100 expert demos, TD3+BC (weight 2.5 -> 0 over 100k)", "hypothesis": "demos move the agent past the dive-and-abort and hover optima", "verdict": "failed", "runs": "outputs/r1_td3bc", "result": "bar missed: F/T 20, 6, 19, 37, 15 /50 (mean 38.8 %, no seed >= 80 %); no F/T 8, 9, 11, 11, 12 /50. vs baseline F/T 9, 6, 0, 49, 0: no zero seeds any more and a higher mean, but no seed solves it", "note": "3 F/T seeds rose to 35-40 % eval by 30-70k, then collapsed to 0 at 80-100k, when the BC weight reached 0 -> back into dive-and-abort. Code kept (flags, off by default); follow-up R1b"}
{"ts": "2026-09-29T10:05", "id": "R2-impl", "kind": "infra", "title": "Asymmetric critic implemented behind --asym-critic", "hypothesis": "critic sees hole - tip (xy) and depth; the actor sees only sensors, so the deployed policy stays unprivileged", "result": "unit test: critic fits a reward that depends only on the privileged input (TD error -80 %), actor input unchanged; smoke run with demos OK. Not launched: the machine is busy with R1", "verdict": "kept"}
{"ts": "2026-09-29T10:41", "id": "R1b", "kind": "experiment", "title": "Demos with a BC floor (2.5 -> 1.0, never 0), F/T x5", "hypothesis": "the R1 collapse happens when BC reaches 0; a floor keeps the demo-level behaviour while RL improves on it", "verdict": "kept", "runs": "outputs/r1b_bcfloor", "note": "best recipe so far, bar narrowly missed; the two failures (seeds 1, 3) fell into dive-and-abort early (best checkpoints at 80k and 20k)", "result": "F/T 45, 7, 44, 6, 44 /50: 3 of 5 seeds at 88-90 % (bar needs 4), mean 58.4 % (baseline 25.6 %, R1 38.8 %); winners insert in ~32 steps, peak force < 50 N"}
{"ts": "2026-09-29T10:41", "id": "R2", "kind": "experiment", "title": "Asymmetric critic alone (no demos), F/T x5", "hypothesis": "a critic that sees hole - tip gives the actor a useful gradient before it can find the hole by chance", "verdict": "reverted", "runs": "outputs/r2_asym", "note": "--asym-critic stays off (default 0) and is not combined in R3", "result": "F/T 12, 17, 7, 6, 13 /50, mean 22 % vs baseline 25.6 %: no benefit"}
{"ts": "2026-09-29T11:47", "id": "R3a", "kind": "experiment", "title": "Stronger imitation: BC 5.0 -> floor 2.5 (R1b recipe otherwise), F/T seeds 0-4", "hypothesis": "the failing seeds dive because the BC term is too weak against the Q term; doubling it keeps them on the demo behaviour", "verdict": "kept", "runs": "outputs/r1c_bcstrong", "result": "F/T 45, 8, 26, 49, 46 /50 (same seeds as R1b: 45, 7, 44, 6, 44): 3 of 5 at >= 80 %, mean 69.6 % vs 58.4 %; rescued seed 3 (6 -> 49), seed 1 still dives early, seed 2 still climbing at 150k", "note": "best mean so far; being measured on 5 more seeds (R3c)"}
{"ts": "2026-09-29T11:47", "id": "R3b", "kind": "experiment", "title": "R1b recipe on 5 more seeds (5-9)", "hypothesis": "measures whether 3 of 5 is typical for the BC-floor recipe", "verdict": "kept", "runs": "outputs/r1b_bcfloor", "note": "same runs dir as R1b; seeds 5-9", "result": "seeds 5-9: 50, 35, 25, 50, 5 /50. R1b over 10 seeds: 5 of 10 at >= 80 %, mean 62.2 %; every failure is an early dive-and-abort (best checkpoints at 20-80k)"}
{"ts": "2026-09-29T12:44", "id": "R3-pretrain", "kind": "experiment", "title": "Offline TD3+BC pretraining on the demos before interaction (probe)", "hypothesis": "an actor pretrained on demos starts competent, so RL never passes through the dive-and-abort phase", "result": "rejected on probes, not launched: pretrained actors abort in 10/10 episodes even with the Q term off (BC loss 0.0004). Trace: imitation is fine on expert states, but (1) the expert's own rim contact is 35-42 N against a 60 N abort, so a slightly faster approach (-0.26 vs -0.17) aborts, and (2) the one-step 0.5 mm correction regresses to ~0.1 (Lesson 2 again)", "verdict": "reverted", "note": "--pretrain-steps / --pretrain-q-weight stay at 0 / 1 (off). Q-extrapolation hypothesis also rejected along the way"}
{"ts": "2026-09-29T12:47", "id": "R3c", "kind": "experiment", "title": "R3a recipe (BC 5.0 -> 2.5) on seeds 5-9", "hypothesis": "10-seed estimate of the stronger-imitation recipe, to compare with R1b's 5/10", "verdict": "inconclusive", "runs": "outputs/r1c_bcstrong", "result": "seeds 5-9: 40, 15, 39, 0, 43 /50. Over 10 seeds both recipes are identical: 5/10 at >= 80 %, mean 62.2 % (BC 5->2.5: 45, 8, 26, 49, 46, 40, 15, 39, 0, 43; BC 2.5->1.0: 45, 7, 44, 6, 44, 50, 35, 25, 50, 5)", "note": "imitation strength is not the lever; the failures are the same early dive-and-abort (one hover-timeout). R1b recipe kept as the base"}
{"ts": "2026-09-29T13:48", "id": "R3d", "kind": "experiment", "title": "Rim speed limit (0.5 mm/step within 5 mm of the rim) + R1b recipe, seeds 0-9", "hypothesis": "every failed run collapses into dive-and-abort; a controller-level speed limit near contact (known rim height, not privileged; the expert's own contact speed) removes that basin, so RL spends its budget on the lateral search", "verdict": "reverted", "runs": "outputs/r3d_rimlimit", "note": "the dive was a symptom, not the cause: without it the failed runs still never learn the lateral search and hover until timeout. --rim-speed-limit-mm stays 0 (off)", "result": "46, 12, 13, 32, 10, 43, 44, 15, 10, 12 /50: 3/10 at >= 80 %, mean 47.4 % (R1b on the same seeds: 5/10, 62.2 %). Failures turned from force aborts into timeouts"}
{"ts": "2026-09-29T14:42", "id": "R3e", "kind": "experiment", "title": "xy_abs actions for TD3 (lateral target within +-5 mm of the start), R1b recipe, seeds 0-9", "hypothesis": "the failed runs never learn the lateral correction, which as a delta is a one-step pulse that BC and the actor average to ~0 (Lesson 2); as a position it is a persistent step", "verdict": "reverted", "runs": "outputs/r3e_xyabs", "note": "as on the gantry, a position target carries per-step regression error (~0.1-0.25 mm) that is too coarse for 0.5 mm clearance. --action-mode stays delta", "result": "finished seeds: 19, 11, 0, 1, 0, 0, 3, 8 /50 (2 still running, late evals 10-20 %): far below R1b; most runs hover until timeout"}
{"ts": "2026-09-29T15:42", "id": "R3-sum", "kind": "milestone", "title": "R3 closed: best recipe = R1b (demos, BC 2.5 -> 1.0)", "result": "5/10 F/T seeds at >= 80 %, mean 62.2 %. Tried and reverted: stronger BC (same 5/10), rim speed limit (3/10), xy_abs actions (<= 19/50), offline pretraining (probe), asymmetric critic (22 %)", "verdict": "kept", "note": "G5 bar (>= 80 % of seeds) not met; R4 runs the comparison with the best recipe anyway"}
{"ts": "2026-09-29T15:42", "id": "R4", "kind": "experiment", "title": "Final F/T vs no-F/T with the R1b recipe, 10 seeds each", "hypothesis": "with the same recipe, the no-F/T agent still cannot find the hole: the difference is the sensor, not the learning setup", "verdict": "kept", "runs": "outputs/r4_final", "note": "the sensor clearly matters; G5 itself (>= 80 % of seeds reliable) is not met. README section + docs/img/td3_bc_r4.png", "result": "F/T 45, 7, 44, 6, 44, 50, 35, 25, 50, 5 /50 (5/10 >= 80 %, mean 62.2 %) vs no F/T 10, 6, 9, 5, 5, 11, 5, 8, 9, 6 /50 (0/10, mean 14.8 %); holes > 1 mm off: 58 % vs 7 %; permutation p = 0.0014 (one-sided)"}
{"ts": "2026-09-29T16:45", "id": "G5", "kind": "milestone", "title": "G5 closed as not met; the F/T comparison is a result", "result": "best recipe (TD3+BC with a BC floor) makes half the F/T seeds reliable (5/10), none without F/T (0/10), p = 0.0014", "verdict": "failed", "note": "bar not met; the scientific question it served is answered. Next: R5 (ACT-lite ignoring force on the arm)"}
{"ts": "2026-09-29T17:05", "id": "R5", "kind": "experiment", "title": "ACT-lite on the arm: dropout and input LayerNorm", "hypothesis": "dropout 0.1 on 300 episodes regularises away the rare, sharp jam-torque cue (MLP has no dropout)", "result": "dropout 0: val 0.032 (was 0.104) and 50/50 closed-loop = the expert; force zeroed 5/50. No input LayerNorm alone 44/50; both 39/50", "verdict": "kept", "note": "S1.4 open issue solved; --act-dropout 0 recommended for the arm, default kept at 0.1 so earlier results reproduce"}
{"ts": "2026-09-29T17:05", "id": "Q-done", "kind": "milestone", "title": "PLAN \u00a712 queue complete", "result": "G5 not met (TD3+BC: 5/10 F/T seeds reliable, 0/10 without F/T, p = 0.0014); R5 solved (ACT-lite 50/50 without dropout)", "verdict": "kept", "note": "awaiting direction for the next stage"}
{"ts": "2026-09-29T18:10", "id": "V-plan", "kind": "milestone", "title": "Stage 2 plan: bolt/nut sorting with a force-aware VLA (PLAN \u00a713)", "result": "plan published (docs/plans/vla_bolt_nut_sorting_plan.html); decisions: scripted stand-in demos, SmolVLA locally, few parts first, separate VLA image", "verdict": "kept", "note": "verified: SmolVLA keeps state in the VLM prefix (torque token goes into the expert suffix via a subclass); LeRobot needs py>=3.12 / numpy>=2 -> sim and policy talk over TCP; robosuite gripper force limit is 20 N (real Franka Hand 70 N)"}
{"ts": "2026-09-29T18:25", "id": "V0", "kind": "milestone", "title": "V0 VLA image + transport + SmolVLA memory probe", "result": "fvb-vla image (py3.12, torch 2.7.1+cu126, lerobot 0.6.1) built; sim<->policy TCP transport round trip < 200 ms (4 tests); smolvla_base fine-tune (frozen VLM, expert-only, bf16) fits the 10 GB RTX 3080 up to batch 16 (5.9 GB peak, 0.51 s/step), batch 32 OOM; one 50-step action chunk in 126 ms", "verdict": "kept", "note": "gate met. smolvla_base ships 3 cameras + 6-D action; our features (2 cameras, 7-D action + state) get remapped at V6. Training batch 8-16 with gradient accumulation if needed."}
{"ts": "2026-09-29T18:25", "id": "V1", "kind": "milestone", "title": "V1 ISO fasteners, hole block, bin and bucket (src/fvb/envs/fasteners.py)", "result": "M16x50 bolt (ISO 4017, 118 g) and M16 nut (ISO 4032) within 0.1 mm / 5 % mass; 17 mm fine hole with 1 mm chamfer seats bolts at 0 and 1.2 mm offset, jams at 3 mm; 11 tests pass (37 total)", "verdict": "kept", "note": "contact params mix across geoms: steel solref 0.002 1 / solimp 0.95 0.99 0.0005 on parts AND receivers (a soft floor gave 3.6 mm penetration). Gate refined: pile drop at ~2 m/s penetrates 1.4 mm transiently, so gate is transient < 2 mm (no tunnelling through 4 mm walls) + resting < 0.5 mm. 3 mm-offset bolt jams tilted rather than resting on the rim."}
{"ts": "2026-09-29T19:20", "id": "V2", "kind": "milestone", "title": "V2 joint-torque sensor + Franka Hand taxel pads (src/fvb/sensors/)", "result": "static 1 kg load: tau_ext = J^T m g to 4e-7 relative (gate 2 %), F_ext_hat = (0, 0, 9.81) N; pressing a steel probe with 5 / 20 N: taxel sum 5.00 / 20.00 N (gate 5 %), all 16 taxels loaded; point contact CoP lands in the right taxel cell at 3 positions; pad shear sign and magnitude (3 N +- 0.3); force limit 70 N; 10 new tests (47 total)", "verdict": "kept", "note": "tau_ext is computed from one forward pass (tau_J = actuator + passive + the joint's own frictionloss; model = M qacc + bias), so without noise it is exact: the 2 % gate only proves the plumbing; noise 0.05 Nm + per-episode bias 0.1 Nm (estimates, not Franka datasheet) and model mismatch are the real error sources. Fix found by the tests: the finger mesh's convex hull reached to 0.37 mm below the pad face, so pressed objects also touched the finger and part of the force bypassed the pad -> pads now protrude 1.5 mm. MuJoCo contact stiffness scales with effective mass: a 10 g probe at 5 N sank through the soft pad; part-like 100 g steel probes rest < 1 mm deep. Closed empty gripper: pads press each other (4 N) -> grasp detection in V3/V8 must not treat that as a grasp. Sensor read directly from qfrc_actuator instead of a jointactuatorfrc sensor (same quantity, no model edit). Also fixed: progress page counted commits in UTC (0 commits shown last hour)."}
{"ts": "2026-09-29T20:25", "id": "V3", "kind": "milestone", "title": "V3 SortBoltsNuts env (src/fvb/envs/sort_bolts_nuts.py)", "result": "gate met by scripted forcing (9 tests, 56 total): seated bolt vanishes 1.0 s after first seated step; gripped bolt never vanishes; 12 deg tilted bolt in the chamfer never seats (6 deg rejected, 4 deg accepted by the rule); bolt standing beside the block (deep enough, wrong place) never counts, reward 0; nut dropped in bucket counts, nut on the rim / moving does not; 3 bolts + 3 nuts sorted -> outcome success, reward 1. Spawn: 20/20 seeds settle inside the bin (0/60 bolts land upright, all lie flat). 1 kHz physics, 20 Hz control: 15 ms per 50 ms step (3.3x real time) without cameras", "verdict": "kept", "note": "joint torque + taxels sampled every physics step into 2 s ring buffers; obs torque_hist (10 x 15), tactile (max over the control interval), tau_ext; outcome/force_abort (|F_ext_hat| > 80 N)/timeout + dropped/jammed counts in info. Found while building: robosuite hides geom group 0 in cameras and takes inertia from group 0 only -> static scene geoms moved to group 1, parts get non-colliding group-1 visual twins; MuJoCo skips gravcomp unless a body has it at compile time -> vanished bolts are parked at rest on the floor 5 m away instead of floating. robosuite's agentview crops the bin and bucket -> added a 'sortview' front camera (deviation from the plan's agentview). Lowered-beside-the-block reward hack is a regression test from day one."}
{"ts": "2026-09-29T21:40", "id": "V4a", "kind": "fix", "title": "Joint-torque sampling moved after the full physics step", "result": "free-motion tau_ext max 1e-6 N m (was ~50 N phantom F_ext spikes every few steps, which tripped the 80 N force abort in free air); regression test added", "verdict": "kept", "note": "robosuite 1.5 lite_physics runs mj_step1 -> _pre_action -> mj_step2, so at _pre_action qacc and actuator force still belonged to the previous state. Sampling now happens in _update_observables, right after each step."}
{"ts": "2026-09-29T21:40", "id": "V4b", "kind": "fix", "title": "Joint end-stop forces count as joint-internal in tau_J", "result": "a wrist rotation near joint 5's limit read 464 N m of 'external' torque; limit rows now go into tau_J like friction loss", "verdict": "kept", "note": "a real Franka reflexes before the mechanical stop; the stop is inside the joint, not an external wrench"}
{"ts": "2026-09-29T21:40", "id": "V4c", "kind": "fix", "title": "Tray instead of the plan's 80 mm bin (360 x 260 x 40 mm), spawn 60 mm from walls", "result": "the palm sits ~45 mm above the pad centre, so reaching a part near an 80 mm wall drove it into the wall (force abort); spawn check still 20/20 seeds settled", "verdict": "kept", "note": "plan deviation (bin 300 x 220 x 80 in PLAN 13); documented in the env"}
{"ts": "2026-09-29T21:40", "id": "V4-wip", "kind": "step", "title": "V4 scripted expert (src/fvb/policy/sort_expert.py) - in progress", "result": "0/8 full episodes so far (no noise); per part it now works end to end: nuts reach bucket A (5 of 8 seeds get >= 1 nut in), bolts are picked, turned head-up, servoed over the hole and dropped in (seated + vanished in seed 1). Episodes still end in the 80 N force abort, mostly bolt insertion / transport contacts", "verdict": "inconclusive", "note": "expert design: privileged pose tracking with OSC deltas; part-sized pre-grasp aperture; wall-clearance-scored grasp candidates (nut flats, bolt tilted about its shank up to 50 deg); fingertip floor clearance; stop descending at 25 N of estimated contact force; slow final 3 cm; least-rotation insertion approach; rate-limited insertion with stall -> spiral search; integral lateral term. Next: per-phase abort diagnosis on the 8 seeds, then noise, the >=90 % gate on unseen seeds, and recording 200 demos."}
{"ts": "2026-09-29T23:05", "id": "V4-wip2", "kind": "step", "title": "V4 expert: per-phase abort diagnosis, 4 rounds on 8 seeds", "result": "first full episode (seed 1: 6/6 sorted, 2232 steps = 112 s sim); seed 6 5/6; sorted parts over 8 seeds 0 -> 27/48. Remaining: nut grasps at the far tray side end with joint 6 at its 3.75 rad limit (fingers tilt into the floor), bolts dropped outside the tray are not re-picked", "verdict": "inconclusive", "note": "fixed, each from a measured abort: arm hit bucket A / fixture on a low transit (travel with the tip 10 cm up; bucket moved beside the tray to (-0.26, -0.46), the (0.15, 0.40) try stretched the arm to its F_hat-amplifying singularity); re-picking a nut still sliding in the bucket; fast descent (0.4 cap, 0.08 in the last 3 cm, touch stop 15 N); palm on the fixture (bolt grasped by its hex head); bolt pivoting in the grasp at chamfer contact (finger kp 1000 -> 4000, ~45 N grip, under the Hand's 70 N) and contact insertion replaced by hover 4 mm above the hole + drop when lateral < 0.7 mm and tilt < 2 deg (integral term only near the goal: it wound up in transit and overshot +-5 mm); gripper fully open before retreat (backing off dragged bolts out); joint-7-aware grasp yaw. Plan deviation: no spiral search (the drop needs no contact search)."}
{"ts": "2026-09-30T00:10", "id": "V4-wip3", "kind": "step", "title": "V4 expert: home pose between parts, enter-then-release, return-to-tray", "result": "3/8 full episodes (seeds 2, 5, 6; was 1/8), seed 3 5/6; sorted parts 27/48 -> 36/48 (no noise)", "verdict": "inconclusive", "note": "kept: return to the start pose between parts (the redundant arm drifted to joint 6's 3.75 rad limit after horizontal-hand moves); lower the aligned tip 8 mm into the hole before opening (dropping from the hover height let the slowly opening fingers push the bolt over); a bolt still held when a phase times out is carried back to the tray instead of dropped over the fixture. Tried and reverted: least-yaw grasp choice instead of the joint-7-aware one (1/8 full episodes vs 3/8). Env now reports MuJoCo bad-acceleration resets as outcome 'sim_unstable' (seen once with the reverted variant). Remaining: bolt top-down descents that still pin joint 6 (seeds 0, 4, 7), bolts lost to the table."}
